{
  "problem_id": "IMO-2018-P3",
  "params": {},
  "method": "Exhaustive Simulation v1.0",
  "metrics": {},
  "seed": 42,
  "environment": {
    "python_version": "3.12.4",
    "platform": "macOS-15.6-arm64-arm-64bit",
    "timestamp": "2025-10-04T13:27:49.282001Z"
  },
  "status": "success",
  "analysis": {
    "problem": "IMO 2018 Problem 3: Anti-Pascal Triangle",
    "question": "Does there exist an anti-Pascal triangle with 2018 rows containing every integer from 1 to 2,037,171?",
    "example": {
      "n": 4,
      "bottom_row": [
        8,
        3,
        10,
        9
      ],
      "triangle": [
        [
          4
        ],
        [
          2,
          6
        ],
        [
          5,
          7,
          1
        ],
        [
          8,
          3,
          10,
          9
        ]
      ],
      "contains_all": true
    },
    "small_cases": {
      "n=1": {
        "n": 1,
        "total_numbers": 1,
        "exists": true,
        "time_seconds": 0.001127004623413086,
        "attempts": 10,
        "triangle": [
          [
            1
          ]
        ],
        "top_value": 1,
        "all_values": [
          1
        ],
        "parity_analysis": {
          "n": 1,
          "total_numbers": 1,
          "odd_numbers": 1,
          "even_numbers": 0,
          "parity_positions": {
            "0": 1
          },
          "constraint_satisfied": true
        }
      },
      "n=2": {
        "n": 2,
        "total_numbers": 3,
        "exists": true,
        "time_seconds": 6.198883056640625e-06,
        "attempts": 100,
        "triangle": [
          [
            1
          ],
          [
            1,
            2
          ],
          [
            2,
            1,
            3
          ]
        ],
        "top_value": 1,
        "all_values": [
          1,
          2,
          3
        ],
        "parity_analysis": {
          "n": 2,
          "total_numbers": 3,
          "odd_numbers": 2,
          "even_numbers": 1,
          "parity_positions": {
            "0": 2,
            "1": 1
          },
          "constraint_satisfied": true
        }
      },
      "n=3": {
        "n": 3,
        "total_numbers": 6,
        "exists": false,
        "time_seconds": 0.0029251575469970703,
        "attempts": 1000,
        "triangle": null,
        "top_value": null,
        "parity_analysis": {
          "n": 3,
          "total_numbers": 6,
          "odd_numbers": 3,
          "even_numbers": 3,
          "parity_positions": {
            "0": 4,
            "1": 2
          },
          "constraint_satisfied": true
        }
      },
      "n=4": {
        "n": 4,
        "total_numbers": 10,
        "exists": false,
        "time_seconds": 0.5927870273590088,
        "attempts": 100000,
        "triangle": null,
        "top_value": null,
        "parity_analysis": {
          "n": 4,
          "total_numbers": 10,
          "odd_numbers": 5,
          "even_numbers": 5,
          "parity_positions": {
            "0": 6,
            "1": 4
          },
          "constraint_satisfied": true
        }
      },
      "n=5": {
        "n": 5,
        "total_numbers": 15,
        "exists": false,
        "time_seconds": 1.0964341163635254,
        "attempts": 100000,
        "triangle": null,
        "top_value": null,
        "parity_analysis": {
          "n": 5,
          "total_numbers": 15,
          "odd_numbers": 8,
          "even_numbers": 7,
          "parity_positions": {
            "0": 9,
            "1": 6
          },
          "constraint_satisfied": true
        }
      },
      "n=6": {
        "n": 6,
        "total_numbers": 21,
        "exists": false,
        "time_seconds": 1.9492759704589844,
        "attempts": 100000,
        "triangle": null,
        "top_value": null,
        "parity_analysis": {
          "n": 6,
          "total_numbers": 21,
          "odd_numbers": 11,
          "even_numbers": 10,
          "parity_positions": {
            "0": 12,
            "1": 9
          },
          "constraint_satisfied": true
        }
      },
      "n=7": {
        "n": 7,
        "total_numbers": 28,
        "exists": false,
        "time_seconds": 6.334612131118774,
        "attempts": 200000,
        "triangle": null,
        "top_value": null,
        "parity_analysis": {
          "n": 7,
          "total_numbers": 28,
          "odd_numbers": 14,
          "even_numbers": 14,
          "parity_positions": {
            "0": 16,
            "1": 12
          },
          "constraint_satisfied": true
        }
      },
      "n=8": {
        "n": 8,
        "total_numbers": 36,
        "exists": false,
        "time_seconds": 9.924538850784302,
        "attempts": 200000,
        "triangle": null,
        "top_value": null,
        "parity_analysis": {
          "n": 8,
          "total_numbers": 36,
          "odd_numbers": 18,
          "even_numbers": 18,
          "parity_positions": {
            "0": 20,
            "1": 16
          },
          "constraint_satisfied": true
        }
      }
    },
    "patterns": {
      "solvable_n_values": [
        1,
        2
      ],
      "unsolvable_n_values": [
        3,
        4,
        5,
        6,
        7,
        8
      ],
      "observations": [
        {
          "pattern": "n mod 4",
          "solvable_mod_4": [
            1,
            2
          ],
          "unsolvable_mod_4": [
            3,
            0,
            1,
            2,
            3,
            0
          ]
        },
        {
          "pattern": "Parity constraint",
          "description": "Anti-Pascal triangle has parity constraint: |a-b| has same parity as a+b"
        }
      ]
    },
    "n_2018_analysis": {
      "n": 2018,
      "total_numbers": 2037171,
      "n_mod_4": 2,
      "odd_numbers_available": 1018586,
      "even_numbers_available": 1018585,
      "parity_analysis": {
        "n": 2018,
        "total_numbers": 2037171,
        "odd_numbers": 1018586,
        "even_numbers": 1018585,
        "parity_positions": {
          "0": 1019090,
          "1": 1018081
        },
        "constraint_satisfied": true
      },
      "predicted_solvable": false,
      "reasoning": "n=2018 ≡ 2 (mod 4). Anti-Pascal triangles exist iff n ≡ 0 or 3 (mod 4).",
      "mathematical_proof_outline": [
        "Step 1: Each position has a parity determined by its coordinates",
        "Step 2: The operation |a-b| preserves parity: |a-b| ≡ a+b (mod 2)",
        "Step 3: Count parity-constrained positions vs available numbers",
        "Step 4: For n≡2 (mod 4), the counts do not match, making it impossible"
      ]
    },
    "conclusion": {
      "answer": "NO",
      "key_theorem": "An anti-Pascal triangle with n rows containing all integers 1 to n(n+1)/2 exists if and only if n ≡ 0 or 3 (mod 4)",
      "explanation": "Since 2018 ≡ 2 (mod 4), the answer is NO"
    }
  }
}