{
  "problem_id": "IMO-2011-P4",
  "params": {},
  "method": "Combinatorial Simulation v1.0",
  "metrics": {
    "runtime_ms": 4212.38,
    "status": "success"
  },
  "seed": 42,
  "environment": {
    "python_version": "3.12.4",
    "platform": "macOS-15.6-arm64-arm-64bit",
    "timestamp": "2025-10-04T13:27:49.268276Z"
  },
  "status": "success",
  "analysis": {
    "1": {
      "count": 1,
      "n": 1,
      "example_sequences": [
        [
          [
            0,
            "L"
          ]
        ]
      ]
    },
    "2": {
      "count": 3,
      "n": 2,
      "example_sequences": [
        [
          [
            0,
            "L"
          ],
          [
            1,
            "L"
          ]
        ],
        [
          [
            1,
            "L"
          ],
          [
            0,
            "L"
          ]
        ],
        [
          [
            1,
            "L"
          ],
          [
            0,
            "R"
          ]
        ]
      ]
    },
    "3": {
      "count": 15,
      "n": 3,
      "example_sequences": [
        [
          [
            0,
            "L"
          ],
          [
            1,
            "L"
          ],
          [
            2,
            "L"
          ]
        ],
        [
          [
            0,
            "L"
          ],
          [
            2,
            "L"
          ],
          [
            1,
            "L"
          ]
        ],
        [
          [
            0,
            "L"
          ],
          [
            2,
            "L"
          ],
          [
            1,
            "R"
          ]
        ]
      ]
    },
    "4": {
      "count": 105,
      "n": 4,
      "example_sequences": [
        [
          [
            0,
            "L"
          ],
          [
            1,
            "L"
          ],
          [
            2,
            "L"
          ],
          [
            3,
            "L"
          ]
        ],
        [
          [
            0,
            "L"
          ],
          [
            1,
            "L"
          ],
          [
            3,
            "L"
          ],
          [
            2,
            "L"
          ]
        ],
        [
          [
            0,
            "L"
          ],
          [
            1,
            "L"
          ],
          [
            3,
            "L"
          ],
          [
            2,
            "R"
          ]
        ]
      ]
    },
    "5": {
      "count": 945,
      "n": 5,
      "example_sequences": [
        [
          [
            0,
            "L"
          ],
          [
            1,
            "L"
          ],
          [
            2,
            "L"
          ],
          [
            3,
            "L"
          ],
          [
            4,
            "L"
          ]
        ],
        [
          [
            0,
            "L"
          ],
          [
            1,
            "L"
          ],
          [
            2,
            "L"
          ],
          [
            4,
            "L"
          ],
          [
            3,
            "L"
          ]
        ],
        [
          [
            0,
            "L"
          ],
          [
            1,
            "L"
          ],
          [
            2,
            "L"
          ],
          [
            4,
            "L"
          ],
          [
            3,
            "R"
          ]
        ]
      ]
    },
    "6": {
      "count": 10395,
      "n": 6,
      "example_sequences": [
        [
          [
            0,
            "L"
          ],
          [
            1,
            "L"
          ],
          [
            2,
            "L"
          ],
          [
            3,
            "L"
          ],
          [
            4,
            "L"
          ],
          [
            5,
            "L"
          ]
        ],
        [
          [
            0,
            "L"
          ],
          [
            1,
            "L"
          ],
          [
            2,
            "L"
          ],
          [
            3,
            "L"
          ],
          [
            5,
            "L"
          ],
          [
            4,
            "L"
          ]
        ],
        [
          [
            0,
            "L"
          ],
          [
            1,
            "L"
          ],
          [
            2,
            "L"
          ],
          [
            3,
            "L"
          ],
          [
            5,
            "L"
          ],
          [
            4,
            "R"
          ]
        ]
      ]
    },
    "7": {
      "count": 135135,
      "n": 7,
      "example_sequences": [
        [
          [
            0,
            "L"
          ],
          [
            1,
            "L"
          ],
          [
            2,
            "L"
          ],
          [
            3,
            "L"
          ],
          [
            4,
            "L"
          ],
          [
            5,
            "L"
          ],
          [
            6,
            "L"
          ]
        ],
        [
          [
            0,
            "L"
          ],
          [
            1,
            "L"
          ],
          [
            2,
            "L"
          ],
          [
            3,
            "L"
          ],
          [
            4,
            "L"
          ],
          [
            6,
            "L"
          ],
          [
            5,
            "L"
          ]
        ],
        [
          [
            0,
            "L"
          ],
          [
            1,
            "L"
          ],
          [
            2,
            "L"
          ],
          [
            3,
            "L"
          ],
          [
            4,
            "L"
          ],
          [
            6,
            "L"
          ],
          [
            5,
            "R"
          ]
        ]
      ]
    },
    "8": {
      "count": 2027025,
      "n": 8,
      "example_sequences": [
        [
          [
            0,
            "L"
          ],
          [
            1,
            "L"
          ],
          [
            2,
            "L"
          ],
          [
            3,
            "L"
          ],
          [
            4,
            "L"
          ],
          [
            5,
            "L"
          ],
          [
            6,
            "L"
          ],
          [
            7,
            "L"
          ]
        ],
        [
          [
            0,
            "L"
          ],
          [
            1,
            "L"
          ],
          [
            2,
            "L"
          ],
          [
            3,
            "L"
          ],
          [
            4,
            "L"
          ],
          [
            5,
            "L"
          ],
          [
            7,
            "L"
          ],
          [
            6,
            "L"
          ]
        ],
        [
          [
            0,
            "L"
          ],
          [
            1,
            "L"
          ],
          [
            2,
            "L"
          ],
          [
            3,
            "L"
          ],
          [
            4,
            "L"
          ],
          [
            5,
            "L"
          ],
          [
            7,
            "L"
          ],
          [
            6,
            "R"
          ]
        ]
      ]
    }
  }
}