{
  "problem_id": "IMO-2002-P1",
  "params": {},
  "method": "Combinatorial Simulation v1.0",
  "metrics": {
    "runtime_ms": 131.45,
    "status": "success"
  },
  "seed": 42,
  "environment": {
    "python_version": "3.12.4",
    "platform": "macOS-15.6-arm64-arm-64bit",
    "timestamp": "2025-10-04T13:27:49.259766Z"
  },
  "status": "success",
  "analysis": {
    "1": {
      "n": 1,
      "total_points": 1,
      "valid_colorings": 2,
      "conjecture_holds": true,
      "num_counterexamples": 0,
      "counterexamples": [],
      "sample_results": [
        {
          "blue_points": [],
          "num_type1": 0,
          "num_type2": 0,
          "equal": true
        },
        {
          "blue_points": [
            [
              0,
              0
            ]
          ],
          "num_type1": 1,
          "num_type2": 1,
          "equal": true
        }
      ]
    },
    "2": {
      "n": 2,
      "total_points": 3,
      "valid_colorings": 5,
      "conjecture_holds": true,
      "num_counterexamples": 0,
      "counterexamples": [],
      "sample_results": [
        {
          "blue_points": [],
          "num_type1": 0,
          "num_type2": 0,
          "equal": true
        },
        {
          "blue_points": [
            [
              0,
              1
            ]
          ],
          "num_type1": 0,
          "num_type2": 0,
          "equal": true
        },
        {
          "blue_points": [
            [
              1,
              0
            ]
          ],
          "num_type1": 0,
          "num_type2": 0,
          "equal": true
        },
        {
          "blue_points": [
            [
              0,
              1
            ],
            [
              1,
              0
            ]
          ],
          "num_type1": 1,
          "num_type2": 1,
          "equal": true
        },
        {
          "blue_points": [
            [
              0,
              0
            ],
            [
              0,
              1
            ],
            [
              1,
              0
            ]
          ],
          "num_type1": 2,
          "num_type2": 2,
          "equal": true
        }
      ]
    },
    "3": {
      "n": 3,
      "total_points": 6,
      "valid_colorings": 14,
      "conjecture_holds": true,
      "num_counterexamples": 0,
      "counterexamples": [],
      "sample_results": [
        {
          "blue_points": [],
          "num_type1": 0,
          "num_type2": 0,
          "equal": true
        },
        {
          "blue_points": [
            [
              1,
              1
            ]
          ],
          "num_type1": 0,
          "num_type2": 0,
          "equal": true
        },
        {
          "blue_points": [
            [
              2,
              0
            ]
          ],
          "num_type1": 0,
          "num_type2": 0,
          "equal": true
        },
        {
          "blue_points": [
            [
              0,
              2
            ]
          ],
          "num_type1": 0,
          "num_type2": 0,
          "equal": true
        },
        {
          "blue_points": [
            [
              1,
              1
            ],
            [
              2,
              0
            ]
          ],
          "num_type1": 0,
          "num_type2": 0,
          "equal": true
        },
        {
          "blue_points": [
            [
              0,
              2
            ],
            [
              1,
              1
            ]
          ],
          "num_type1": 0,
          "num_type2": 0,
          "equal": true
        },
        {
          "blue_points": [
            [
              0,
              2
            ],
            [
              2,
              0
            ]
          ],
          "num_type1": 0,
          "num_type2": 0,
          "equal": true
        },
        {
          "blue_points": [
            [
              0,
              1
            ],
            [
              0,
              2
            ],
            [
              1,
              1
            ]
          ],
          "num_type1": 0,
          "num_type2": 0,
          "equal": true
        },
        {
          "blue_points": [
            [
              0,
              2
            ],
            [
              1,
              1
            ],
            [
              2,
              0
            ]
          ],
          "num_type1": 1,
          "num_type2": 1,
          "equal": true
        },
        {
          "blue_points": [
            [
              1,
              0
            ],
            [
              1,
              1
            ],
            [
              2,
              0
            ]
          ],
          "num_type1": 0,
          "num_type2": 0,
          "equal": true
        }
      ]
    },
    "4": {
      "n": 4,
      "total_points": 10,
      "valid_colorings": 42,
      "conjecture_holds": true,
      "num_counterexamples": 0,
      "counterexamples": [],
      "sample_results": [
        {
          "blue_points": [],
          "num_type1": 0,
          "num_type2": 0,
          "equal": true
        },
        {
          "blue_points": [
            [
              1,
              2
            ]
          ],
          "num_type1": 0,
          "num_type2": 0,
          "equal": true
        },
        {
          "blue_points": [
            [
              2,
              1
            ]
          ],
          "num_type1": 0,
          "num_type2": 0,
          "equal": true
        },
        {
          "blue_points": [
            [
              0,
              3
            ]
          ],
          "num_type1": 0,
          "num_type2": 0,
          "equal": true
        },
        {
          "blue_points": [
            [
              3,
              0
            ]
          ],
          "num_type1": 0,
          "num_type2": 0,
          "equal": true
        },
        {
          "blue_points": [
            [
              1,
              2
            ],
            [
              2,
              1
            ]
          ],
          "num_type1": 0,
          "num_type2": 0,
          "equal": true
        },
        {
          "blue_points": [
            [
              0,
              3
            ],
            [
              1,
              2
            ]
          ],
          "num_type1": 0,
          "num_type2": 0,
          "equal": true
        },
        {
          "blue_points": [
            [
              1,
              2
            ],
            [
              3,
              0
            ]
          ],
          "num_type1": 0,
          "num_type2": 0,
          "equal": true
        },
        {
          "blue_points": [
            [
              0,
              3
            ],
            [
              2,
              1
            ]
          ],
          "num_type1": 0,
          "num_type2": 0,
          "equal": true
        },
        {
          "blue_points": [
            [
              2,
              1
            ],
            [
              3,
              0
            ]
          ],
          "num_type1": 0,
          "num_type2": 0,
          "equal": true
        }
      ]
    },
    "5": {
      "n": 5,
      "total_points": 15,
      "valid_colorings": 132,
      "conjecture_holds": true,
      "num_counterexamples": 0,
      "counterexamples": [],
      "sample_results": [
        {
          "blue_points": [],
          "num_type1": 0,
          "num_type2": 0,
          "equal": true
        },
        {
          "blue_points": [
            [
              0,
              4
            ]
          ],
          "num_type1": 0,
          "num_type2": 0,
          "equal": true
        },
        {
          "blue_points": [
            [
              4,
              0
            ]
          ],
          "num_type1": 0,
          "num_type2": 0,
          "equal": true
        },
        {
          "blue_points": [
            [
              3,
              1
            ]
          ],
          "num_type1": 0,
          "num_type2": 0,
          "equal": true
        },
        {
          "blue_points": [
            [
              2,
              2
            ]
          ],
          "num_type1": 0,
          "num_type2": 0,
          "equal": true
        },
        {
          "blue_points": [
            [
              1,
              3
            ]
          ],
          "num_type1": 0,
          "num_type2": 0,
          "equal": true
        },
        {
          "blue_points": [
            [
              0,
              4
            ],
            [
              4,
              0
            ]
          ],
          "num_type1": 0,
          "num_type2": 0,
          "equal": true
        },
        {
          "blue_points": [
            [
              0,
              4
            ],
            [
              3,
              1
            ]
          ],
          "num_type1": 0,
          "num_type2": 0,
          "equal": true
        },
        {
          "blue_points": [
            [
              0,
              4
            ],
            [
              2,
              2
            ]
          ],
          "num_type1": 0,
          "num_type2": 0,
          "equal": true
        },
        {
          "blue_points": [
            [
              0,
              4
            ],
            [
              1,
              3
            ]
          ],
          "num_type1": 0,
          "num_type2": 0,
          "equal": true
        }
      ]
    }
  }
}